{
  "schemaVersion": "lfe.state/0.1",
  "projectId": "minha-ideia",
  "name": "Minha ideia",
  "locale": "pt-BR",
  "mode": "project",
  "stage": "S9",
  "artifacts": {},
  "gatesCache": {
    "G1": {
      "status": "approved",
      "decisionId": "DEC-001"
    },
    "G2": {
      "status": "approved",
      "decisionId": "DEC-002"
    },
    "G3": {
      "status": "approved",
      "decisionId": "DEC-003"
    },
    "G4": {
      "status": "approved",
      "decisionId": "DEC-004"
    },
    "G5": {
      "status": "approved",
      "decisionId": "DEC-005"
    },
    "G6": {
      "status": "not_applicable",
      "decisionId": "DEC-006"
    }
  },
  "nextAction": "Perguntar objetivo e público",
  "updatedAt": "2026-10-19T09:00:00Z"
}
